{
  "schemaVersion": 1,
  "id": "classic.buttons",
  "profileId": "m3-classic.compose-material3-1.4.0",
  "status": "seeded",
  "family": "Buttons",
  "anchorComponentId": "button.filled",
  "sourceRefs": [
    "m3-buttons",
    "m3-design-tokens",
    "m3-states",
    "androidx-material3-1.4.0"
  ],
  "variants": [
    {
      "id": "text",
      "componentId": "button.text",
      "materialName": "Text button",
      "required": true,
      "classification": "MUST_MATCH",
      "sourceRefs": [
        "m3-buttons",
        "androidx-material3-1.4.0"
      ]
    },
    {
      "id": "filled",
      "componentId": "button.filled",
      "materialName": "Filled button",
      "required": true,
      "classification": "MUST_MATCH",
      "sourceRefs": [
        "m3-buttons",
        "androidx-material3-1.4.0"
      ]
    },
    {
      "id": "filled-tonal",
      "componentId": "button.filled-tonal",
      "materialName": "Filled tonal button",
      "required": true,
      "classification": "MUST_MATCH",
      "sourceRefs": [
        "m3-buttons",
        "androidx-material3-1.4.0"
      ]
    },
    {
      "id": "outlined",
      "componentId": "button.outlined",
      "materialName": "Outlined button",
      "required": true,
      "classification": "MUST_MATCH",
      "sourceRefs": [
        "m3-buttons",
        "androidx-material3-1.4.0"
      ]
    },
    {
      "id": "elevated",
      "componentId": "button.elevated",
      "materialName": "Elevated button",
      "required": true,
      "classification": "MUST_MATCH",
      "sourceRefs": [
        "m3-buttons",
        "androidx-material3-1.4.0"
      ]
    }
  ],
  "slots": [
    {
      "id": "container",
      "cardinality": "exactly-one",
      "variants": [
        "text",
        "filled",
        "filled-tonal",
        "outlined",
        "elevated"
      ],
      "classification": "MUST_MATCH",
      "sourceRefs": [
        "m3-buttons"
      ]
    },
    {
      "id": "label",
      "cardinality": "exactly-one",
      "variants": [
        "text",
        "filled",
        "filled-tonal",
        "outlined",
        "elevated"
      ],
      "classification": "MUST_MATCH",
      "sourceRefs": [
        "m3-buttons"
      ]
    },
    {
      "id": "leading-icon",
      "cardinality": "zero-or-one",
      "variants": [
        "text",
        "filled",
        "filled-tonal",
        "outlined",
        "elevated"
      ],
      "classification": "MUST_MATCH",
      "sourceRefs": [
        "m3-buttons",
        "androidx-material3-1.4.0"
      ]
    },
    {
      "id": "state-layer",
      "cardinality": "exactly-one",
      "variants": [
        "text",
        "filled",
        "filled-tonal",
        "outlined",
        "elevated"
      ],
      "classification": "MUST_MATCH",
      "sourceRefs": [
        "m3-buttons",
        "m3-states"
      ]
    },
    {
      "id": "outline",
      "cardinality": "exactly-one",
      "variants": [
        "outlined"
      ],
      "classification": "MUST_MATCH",
      "sourceRefs": [
        "m3-buttons"
      ]
    },
    {
      "id": "elevation",
      "cardinality": "exactly-one",
      "variants": [
        "elevated"
      ],
      "classification": "MUST_MATCH",
      "sourceRefs": [
        "m3-buttons"
      ]
    },
    {
      "id": "focus-indicator",
      "cardinality": "exactly-one",
      "variants": [
        "text",
        "filled",
        "filled-tonal",
        "outlined",
        "elevated"
      ],
      "classification": "PLATFORM_ADAPTATION",
      "sourceRefs": [
        "m3-states"
      ],
      "rationale": "Qt desktop exposes a distinct keyboard-focus affordance in addition to the Material focus state layer."
    }
  ],
  "states": [
    {
      "id": "enabled",
      "required": true,
      "classification": "MUST_MATCH",
      "sourceRefs": [
        "m3-buttons",
        "m3-states"
      ]
    },
    {
      "id": "disabled",
      "required": true,
      "classification": "MUST_MATCH",
      "sourceRefs": [
        "m3-buttons",
        "m3-states"
      ]
    },
    {
      "id": "hovered",
      "required": true,
      "classification": "MUST_MATCH",
      "sourceRefs": [
        "m3-buttons",
        "m3-states"
      ]
    },
    {
      "id": "focused",
      "required": true,
      "classification": "MUST_MATCH",
      "sourceRefs": [
        "m3-buttons",
        "m3-states"
      ]
    },
    {
      "id": "pressed",
      "required": true,
      "classification": "MUST_MATCH",
      "sourceRefs": [
        "m3-buttons",
        "m3-states"
      ]
    }
  ],
  "tokenRoles": [
    {
      "id": "container.color",
      "domain": "colors",
      "classification": "MUST_MATCH",
      "variants": ["text", "filled", "filled-tonal", "outlined", "elevated"],
      "resolvedSpecPaths": ["containerColor", "disabledContainerColor"],
      "sourceRefs": ["m3-buttons", "m3-design-tokens", "androidx-material3-1.4.0"]
    },
    {
      "id": "content.label.color",
      "domain": "colors",
      "classification": "MUST_MATCH",
      "variants": ["text", "filled", "filled-tonal", "outlined", "elevated"],
      "resolvedSpecPaths": ["labelColor", "disabledLabelColor"],
      "sourceRefs": ["m3-buttons", "m3-design-tokens", "androidx-material3-1.4.0"]
    },
    {
      "id": "content.icon.color",
      "domain": "colors",
      "classification": "MUST_MATCH",
      "variants": ["text", "filled", "filled-tonal", "outlined", "elevated"],
      "resolvedSpecPaths": ["iconColor"],
      "sourceRefs": ["m3-buttons", "m3-design-tokens", "androidx-material3-1.4.0"]
    },
    {
      "id": "state-layer.color",
      "domain": "states",
      "classification": "MUST_MATCH",
      "variants": ["text", "filled", "filled-tonal", "outlined", "elevated"],
      "resolvedSpecPaths": ["stateLayerColor"],
      "sourceRefs": ["m3-buttons", "m3-states", "androidx-material3-1.4.0"]
    },
    {
      "id": "focus-indicator.color",
      "domain": "states",
      "classification": "PLATFORM_ADAPTATION",
      "variants": ["text", "filled", "filled-tonal", "outlined", "elevated"],
      "resolvedSpecPaths": ["focusRingColor", "focusRingWidth"],
      "sourceRefs": ["m3-states"],
      "rationale": "A separate Qt desktop focus ring is measured as an adaptation, not scored as a Material state-layer token."
    },
    {
      "id": "outline.color",
      "domain": "colors",
      "classification": "MUST_MATCH",
      "variants": ["outlined"],
      "resolvedSpecPaths": ["outlineColor", "disabledOutlineColor"],
      "sourceRefs": ["m3-buttons", "m3-design-tokens", "androidx-material3-1.4.0"]
    },
    {
      "id": "outline.width",
      "domain": "geometry",
      "classification": "MUST_MATCH",
      "variants": ["outlined"],
      "resolvedSpecPaths": ["outlineWidth"],
      "sourceRefs": ["m3-buttons", "m3-design-tokens", "androidx-material3-1.4.0"]
    },
    {
      "id": "container.shape",
      "domain": "tokens",
      "classification": "MUST_MATCH",
      "variants": ["text", "filled", "filled-tonal", "outlined", "elevated"],
      "resolvedSpecPaths": ["shapeRole", "cornerRadius"],
      "sourceRefs": ["m3-buttons", "m3-design-tokens", "androidx-material3-1.4.0"]
    },
    {
      "id": "content.label.typography",
      "domain": "typography",
      "classification": "MUST_MATCH",
      "variants": ["text", "filled", "filled-tonal", "outlined", "elevated"],
      "resolvedSpecPaths": ["labelTypeRole", "labelFont"],
      "sourceRefs": ["m3-buttons", "m3-design-tokens", "androidx-material3-1.4.0"]
    },
    {
      "id": "container.elevation",
      "domain": "tokens",
      "classification": "MUST_MATCH",
      "variants": ["text", "filled", "filled-tonal", "outlined", "elevated"],
      "resolvedSpecPaths": [
        "elevationRole",
        "hoverElevationRole",
        "shadowColor",
        "elevationStyle",
        "hoverElevationStyle",
        "restingElevationProgress",
        "hoverElevationProgress",
        "focusElevationProgress",
        "pressElevationProgress",
        "disabledElevationProgress"
      ],
      "sourceRefs": ["m3-buttons", "m3-design-tokens", "androidx-material3-1.4.0"]
    },
    {
      "id": "interaction.motion",
      "domain": "motion",
      "classification": "MUST_MATCH",
      "variants": ["text", "filled", "filled-tonal", "outlined", "elevated"],
      "resolvedSpecPaths": ["motionToken", "motionStyle"],
      "sourceRefs": ["m3-buttons", "m3-states", "androidx-material3-1.4.0"]
    },
    {
      "id": "state-layer.opacity",
      "domain": "states",
      "classification": "MUST_MATCH",
      "variants": ["text", "filled", "filled-tonal", "outlined", "elevated"],
      "resolvedSpecPaths": ["hoverStateLayerOpacity", "focusStateLayerOpacity", "pressStateLayerOpacity"],
      "sourceRefs": ["m3-buttons", "m3-states", "androidx-material3-1.4.0"]
    },
    {
      "id": "touch-target.size",
      "domain": "accessibility",
      "classification": "MUST_MATCH",
      "variants": ["text", "filled", "filled-tonal", "outlined", "elevated"],
      "resolvedSpecPaths": ["touchTarget"],
      "sourceRefs": ["m3-buttons", "androidx-material3-1.4.0"]
    },
    {
      "id": "container.height",
      "domain": "geometry",
      "classification": "MUST_MATCH",
      "variants": ["text", "filled", "filled-tonal", "outlined", "elevated"],
      "resolvedSpecPaths": ["containerHeight"],
      "sourceRefs": ["m3-buttons", "androidx-material3-1.4.0"]
    },
    {
      "id": "content.horizontal-padding",
      "domain": "geometry",
      "classification": "MUST_MATCH",
      "variants": ["text", "filled", "filled-tonal", "outlined", "elevated"],
      "resolvedSpecPaths": ["horizontalPadding"],
      "sourceRefs": ["m3-buttons", "androidx-material3-1.4.0"]
    },
    {
      "id": "content.icon.size",
      "domain": "geometry",
      "classification": "MUST_MATCH",
      "variants": ["text", "filled", "filled-tonal", "outlined", "elevated"],